<?xml version="1.0" encoding="UTF-8"?>
<!DOCTYPE mapaEstelar SYSTEM "mapaEstelar.dtd">
<mapaEstelar xmlns:xsi="http://www.w3.org/2001/XMLSchema-instance" xsi:noNamespaceSchemaLocation="mapaEstelar.xsd">
    <constelacion nombreLatin="Ursa Maior">
        <nombre>La Osa Mayor</nombre>
        <superficie>1297.7</superficie>
        <estrellas numeroEstrellas="209">
            <asterismo>7</asterismo>
            <masBrillante luminosidad="108">Alioth</masBrillante>
        </estrellas>
        <objetos>
            <cumulos>false</cumulos>
            <nebulosas>false</nebulosas>
            <galaxias>false</galaxias>
            <cuasares>false</cuasares>
            <lluviaMeteoros>
                <nombre>Kappa Ursa Mayoridas</nombre>
                <nombre>Lambda Ursa Mayoridas</nombre>
                <nombre>Psi ursa Mayoridas</nombre>
                <nombre>Ursa Mayoridas de octubre</nombre>
            </lluviaMeteoros>
        </objetos>
        <colindantes>Bootes</colindantes>
        <colindantes>Camelopardalis</colindantes>
        <colindantes>Canes Venatici</colindantes>
        <colindantes>Draco</colindantes>
        <colindantes>Leo</colindantes>
        <colindantes>Leo Minor</colindantes>
        <colindantes>Lynx</colindantes>
        <observacion>
            <hemisferio>Norte</hemisferio>
            <mes>--04</mes>
            <hora>21:00:00</hora>
        </observacion>
    </constelacion>
    <estrella>
        <nombre>Alioth</nombre>
        <constelacion>Ursa Maior</constelacion>
        <distancia medida="anyosLuz">81</distancia>
        <luminosidad medida="soles">108</luminosidad>
        <temperatura medida="K">9400</temperatura>
        <masa medida="soles">3</masa>
    </estrella>
</mapaEstelar>
